id,restaurant_name,reviewer_name,review_text,rating,date_of_visit,location,review_length,month_of_visit
0,Грибова Колиба,Марта,Офіціантка Повільно Обслуговувала велике меню непоганий салат довго чекали на замовлення. Затишне Місце велика сирна тарілка було смачно чудово.,3,2022-05-30,Миргород,144,5
1,Стильна Кавʼярня,Устим,Могло Бути Краще чудово велика сирна тарілка не сподобалось довго чекали на замовлення. Раджу Відвідати погане обслуговування кухня на висоті затишне місце непоганий салат могло бути краще.,4,2022-09-06,Долинська,189,9
2,Грибова Колиба,Валентина,Чудово велике меню приємні ціни піца смачна.,5,2024-01-09,Бібрка,44,1
3,Мʼясна Пекарня,Богуслав,Не Сподобалось чудово гарна територія довго чекали на чек погане обслуговування.,2,2023-05-13,Снігурівка,80,5
4,Апетитна Пирогівня,Лариса,Офіціантка Повільно Обслуговувала принесли пересмажений стейк велике меню принесли пересмажений стейк комфортно довго чекали на замовлення затишне місце.,1,2024-01-21,Корюківка,153,1
5,Пікантна Колиба,Орися,Було Смачно не сподобалось офіціантка повільно обслуговувала найкращі роли борщ був несмачний рекомендую непоганий салат. Піца Смачна раджу спробувати напої власного виробництва страви були холодні піца смачна довго чекали на замовлення.,4,2022-07-01,Львів,237,7
6,Відома Таверна,Леонід,Піца Смачна комфортно класне обслуговування погане обслуговування рекомендую рекомендую рекомендую. Чистий Столик приємні ціни піца смачна велика сирна тарілка довго чекали на замовлення.,1,2022-12-27,Луцьк,187,12
7,Мʼясна Шашлична,Аарон,Довго Чекали На Замовлення приємні ціни найкращі роли сучасний iнтер`єр світлий зал із чудовим краєвидом чудово борщ був несмачний.,3,2022-03-11,Костопіль,131,3
8,Грибова Закусочна,Опанас,Раджу Відвідати атмосфера чудова чудово враження позитивні довго чекали на замовлення.,1,2023-04-14,Прилуки,86,4
9,Грибова Закусочна,Макар,Класне Обслуговування могло бути краще кухня на висоті жахливо непоганий салат раджу відвідати.,1,2023-02-26,Кагарлик,95,2
10,Чудова Кухня,Леонтій,Довго Чекали На Чек чудово світлий зал із чудовим краєвидом було смачно жахливо.,4,2023-11-19,Покров,80,11
11,Ароматна Шампанерія,Кирило,Чистий Столик довго чекали на замовлення офіціантка повільно обслуговувала борщ був несмачний. Принесли Пересмажений Стейк приємні ціни рекомендую найкращі роли атмосфера чудова.,3,2022-10-28,Верхньодніпровськ,178,10
12,Найкраща Кухня,Ігор,Офіціантка Повільно Обслуговувала жахливо не сподобалось раджу спробувати напої власного виробництва довго чекали на замовлення велике меню.,5,2022-07-18,Виноградів,140,7
13,Райська Бургерна,Валентин,Комфортно не сподобалось атмосфера чудова рекомендую велике меню чудово раджу спробувати напої власного виробництва.,3,2023-11-11,Могилів-Подільський,116,11
14,Стильна Кавʼярня,Володимира,Принесли Холодну Каву було смачно раджу спробувати напої власного виробництва враження позитивні найкращі роли приємні ціни класне обслуговування непоганий салат.,1,2023-09-08,Красилів,162,9
15,Стильна Канапка,Веніямин,Офіціантка Повільно Обслуговувала чудово офіціантка повільно обслуговувала раджу спробувати напої власного виробництва. Довго Чекали На Чек приємні ціни кухня на висоті.,5,2022-04-17,Моршин,169,4
16,Вишукана Піцерія,Федір,Могло Бути Краще чистий столик затишне місце борщ був несмачний. Принесли Пересмажений Стейк велике меню раджу відвідати принесли пересмажений стейк велика сирна тарілка чистий столик. Сучасний Iнтер`Єр комфортно затишне місце світлий зал із чудовим краєвидом.,3,2023-07-31,Барвінкове,260,7
17,Найкраща Шампанерія,Стефан,Сучасний Iнтер`Єр класне обслуговування велика сирна тарілка принесли холодну каву кухня на висоті велика сирна тарілка.,5,2023-05-14,Узин,120,5
18,Відома Таверна,Андрій,Було Смачно найкращі роли не сподобалось приємні ціни.,1,2023-04-09,Первомайськ,54,4
19,Відома Бургерна,Валерій,Чудово рекомендую враження позитивні враження позитивні.,4,2023-10-19,Шаргород,56,10
20,Пікантна Кухня,Ігор,Найкращі Роли непоганий салат принесли пересмажений стейк чудово піца смачна могло бути краще раджу відвідати. Сучасний Iнтер`Єр принесли холодну каву піца смачна найкращі роли довго чекали на замовлення могло бути краще класне обслуговування. Враження Позитивні чистий столик найкращі роли погане обслуговування страви були холодні. Сучасний Iнтер`Єр довго чекали на замовлення страви були холодні принесли пересмажений стейк.,5,2022-04-25,Авдіївка,427,4
21,Стильна Канапка,Василина,Могло Бути Краще приємні ціни принесли холодну каву було смачно сучасний iнтер`єр борщ був несмачний рекомендую.,2,2023-07-17,Олександрія,112,7
22,Мʼясна Страва,Володимир,Довго Чекали На Чек раджу відвідати борщ був несмачний сучасний iнтер`єр кухня на висоті раджу відвідати.,3,2023-01-11,Гірське,105,1
23,Відома Бургерна,Емілія,Приємні Ціни найкращі роли сучасний iнтер`єр кухня на висоті гарна територія найкращі роли. Атмосфера Чудова довго чекали на замовлення не сподобалось чудово раджу відвідати погане обслуговування комфортно. Класне Обслуговування непоганий салат чистий столик гарна територія приємні ціни принесли пересмажений стейк принесли холодну каву.,2,2023-04-30,Городенка,338,4
24,Найкраща Шампанерія,Святослав,Не Сподобалось комфортно гарна територія сучасний iнтер`єр. Кухня На Висоті не сподобалось піца смачна принесли пересмажений стейк. Було Смачно довго чекали на чек затишне місце не сподобалось атмосфера чудова враження позитивні.,4,2022-10-10,Первомайськ,229,10
25,Мʼясна Пекарня,Мирон,Чистий Столик атмосфера чудова атмосфера чудова. Гарна Територія велика сирна тарілка непоганий салат борщ був несмачний. Не Сподобалось принесли холодну каву довго чекали на чек атмосфера чудова.,5,2022-10-27,Бердичів,196,10
26,Відома Бургерна,Олесь,Рекомендую кухня на висоті погане обслуговування офіціантка повільно обслуговувала найкращі роли піца смачна раджу відвідати.,1,2023-10-08,Кам'янка (Черкаська область),125,10
27,Найкраща Шампанерія,Марія,Велике Меню жахливо було смачно кухня на висоті могло бути краще чистий столик страви були холодні раджу спробувати напої власного виробництва. Гарна Територія чистий столик велика сирна тарілка не сподобалось довго чекали на чек велике меню.,3,2023-10-19,Коростишів,242,10
28,Чудова Кухня,Дмитро,Борщ Був Несмачний враження позитивні борщ був несмачний затишне місце чистий столик. Довго Чекали На Чек жахливо атмосфера чудова офіціантка повільно обслуговувала страви були холодні борщ був несмачний.,2,2022-05-27,Чугуїв,204,5
29,Грибова Піцерія,Костянтин,Чистий Столик світлий зал із чудовим краєвидом офіціантка повільно обслуговувала принесли пересмажений стейк кухня на висоті затишне місце.,4,2024-01-30,Суходільськ,139,1
30,Мʼясна Шашлична,Єлисавета,Принесли Холодну Каву сучасний iнтер`єр офіціантка повільно обслуговувала.,2,2024-01-23,Житомир,74,1
31,Мʼясна Пекарня,Адам,Піца Смачна жахливо було смачно борщ був несмачний класне обслуговування довго чекали на чек рекомендую. Класне Обслуговування сучасний iнтер`єр раджу відвідати принесли пересмажений стейк принесли пересмажений стейк комфортно кухня на висоті атмосфера чудова.,3,2022-04-18,Южноукраїнськ,260,4
32,Вишукана Піцерія,Юстина,Враження Позитивні страви були холодні враження позитивні чудово довго чекали на замовлення.,4,2022-07-23,Овруч,92,7
33,Найкраща Кухня,Аліна,Жахливо чудово атмосфера чудова не сподобалось.,4,2023-05-29,Новояворівськ,47,5
34,Грибова Закусочна,Дарина,Затишне Місце кухня на висоті світлий зал із чудовим краєвидом велике меню світлий зал із чудовим краєвидом піца смачна довго чекали на замовлення. Велике Меню гарна територія погане обслуговування офіціантка повільно обслуговувала.,5,2023-02-25,Суходільськ,232,2
35,Райська Кавʼярня,Кирило,Велика Сирна Тарілка велике меню непоганий салат страви були холодні могло бути краще довго чекали на чек жахливо. Раджу Відвідати принесли пересмажений стейк велика сирна тарілка. Затишне Місце затишне місце найкращі роли піца смачна.,3,2022-11-19,Арциз,235,11
36,Відома Таверна,Юхим,Велике Меню гарна територія могло бути краще.,3,2022-04-25,Славутич,45,4
37,Райська Пирогівня,Вікторія,Затишне Місце найкращі роли принесли холодну каву офіціантка повільно обслуговувала класне обслуговування офіціантка повільно обслуговувала.,2,2022-12-26,Нова Одеса,140,12
38,Стильна Кавʼярня,Орест,Чистий Столик не сподобалось раджу відвідати атмосфера чудова довго чекали на чек рекомендую піца смачна.,3,2023-07-08,Зоринськ,105,7
39,Вишукана Забігайлівка,Олена,Приємні Ціни раджу відвідати приємні ціни.,2,2022-03-30,Ізмаїл,42,3
40,Сучасна Варенична,Арсен,Велика Сирна Тарілка кухня на висоті не сподобалось принесли пересмажений стейк борщ був несмачний комфортно. Світлий Зал Із Чудовим Краєвидом приємні ціни велика сирна тарілка не сподобалось. Класне Обслуговування непоганий салат класне обслуговування борщ був несмачний велика сирна тарілка затишне місце.,3,2023-08-02,Вільнянськ,307,8
41,Стильна Кавʼярня,Аврелій,Погане Обслуговування класне обслуговування велике меню непоганий салат погане обслуговування. Найкращі Роли світлий зал із чудовим краєвидом принесли холодну каву погане обслуговування світлий зал із чудовим краєвидом раджу спробувати напої власного виробництва.,5,2023-10-07,Кобеляки,263,10
42,Маленька Шампанерія,Ярослав,Приємні Ціни найкращі роли страви були холодні. Класне Обслуговування непоганий салат кухня на висоті непоганий салат.,5,2022-09-16,Скалат,118,9
43,Мʼясна Пекарня,Дан,Сучасний Iнтер`Єр приємні ціни кухня на висоті було смачно офіціантка повільно обслуговувала принесли пересмажений стейк було смачно.,5,2022-09-09,Таврійськ,133,9
44,Райська Кавʼярня,Венедикт,Чистий Столик велика сирна тарілка непоганий салат непоганий салат велика сирна тарілка приємні ціни комфортно. Сучасний Iнтер`Єр враження позитивні борщ був несмачний погане обслуговування.,2,2023-05-14,Харцизьк,190,5
45,Вишукана Забігайлівка,Юстим,Затишне Місце комфортно борщ був несмачний піца смачна принесли пересмажений стейк враження позитивні погане обслуговування.,2,2023-11-03,Глобине,124,11
46,Райська Бургерна,Устим,Велике Меню було смачно піца смачна велике меню було смачно могло бути краще. Офіціантка Повільно Обслуговувала велика сирна тарілка чудово чудово приємні ціни світлий зал із чудовим краєвидом приємні ціни довго чекали на замовлення. Велике Меню атмосфера чудова офіціантка повільно обслуговувала чудово чудово принесли холодну каву не сподобалось. Рекомендую офіціантка повільно обслуговувала довго чекали на замовлення могло бути краще принесли холодну каву страви були холодні.,1,2022-06-28,Вишгород,480,6
47,Найкраща Шампанерія,Амалія,Приємні Ціни сучасний iнтер`єр було смачно раджу спробувати напої власного виробництва раджу відвідати могло бути краще довго чекали на замовлення класне обслуговування. Атмосфера Чудова непоганий салат чистий столик велике меню піца смачна принесли пересмажений стейк. Страви Були Холодні чудово непоганий салат довго чекали на чек довго чекали на чек велика сирна тарілка страви були холодні.,1,2024-02-01,Нікополь,394,2
48,Райська Кавʼярня,Борислав,Найкращі Роли погане обслуговування світлий зал із чудовим краєвидом довго чекали на замовлення довго чекали на замовлення враження позитивні принесли холодну каву.,1,2022-05-29,Попасна,164,5
49,Райська Бургерна,Тимофій,Чудово затишне місце світлий зал із чудовим краєвидом.,2,2022-03-07,Першотравенськ,54,3
50,Стильна Шашлична,Макар,Приємні Ціни довго чекали на чек кухня на висоті чистий столик погане обслуговування довго чекали на замовлення світлий зал із чудовим краєвидом.,3,2023-05-12,Чернівці,145,5
51,Мʼясна Пекарня,Геннадій,Страви Були Холодні погане обслуговування найкращі роли.,3,2023-05-07,Сновськ,56,5
52,Чудова Кухня,Іван,Раджу Відвідати офіціантка повільно обслуговувала велике меню страви були холодні. Враження Позитивні чистий столик чудово раджу відвідати довго чекали на чек.,3,2022-05-26,Тульчин,159,5
53,Мʼясна Страва,Прохір,Атмосфера Чудова офіціантка повільно обслуговувала погане обслуговування принесли холодну каву офіціантка повільно обслуговувала велика сирна тарілка принесли пересмажений стейк найкращі роли.,4,2023-03-26,Бахмач,192,3
54,Пікантна Колиба,Володимир,Враження Позитивні чистий столик атмосфера чудова найкращі роли довго чекали на замовлення погане обслуговування. Велика Сирна Тарілка світлий зал із чудовим краєвидом комфортно принесли пересмажений стейк найкращі роли.,3,2023-04-03,Коломия,220,4
55,Смачна Забігайлівка,Панас,Погане Обслуговування рекомендую піца смачна погане обслуговування погане обслуговування довго чекали на замовлення.,2,2023-11-19,Єнакієве,116,11
56,Апетитна Пирогівня,Аврелій,Принесли Пересмажений Стейк приємні ціни принесли пересмажений стейк кухня на висоті довго чекали на замовлення найкращі роли погане обслуговування.,4,2022-05-24,Пирятин,148,5
57,Стильна Кавʼярня,Артем,Чистий Столик довго чекали на чек чистий столик чистий столик чудово рекомендую класне обслуговування.,4,2022-08-18,Верхньодніпровськ,102,8
58,Грибова Закусочна,Сергій,Було Смачно затишне місце борщ був несмачний світлий зал із чудовим краєвидом непоганий салат принесли пересмажений стейк. Довго Чекали На Замовлення класне обслуговування непоганий салат. Було Смачно не сподобалось довго чекали на замовлення чудово непоганий салат.,1,2022-03-28,Рахів,266,3
59,Смачна Забігайлівка,Пилип,Велика Сирна Тарілка чудово враження позитивні кухня на висоті кухня на висоті кухня на висоті комфортно принесли пересмажений стейк. Велике Меню принесли пересмажений стейк велике меню чистий столик принесли пересмажений стейк світлий зал із чудовим краєвидом непоганий салат велика сирна тарілка.,4,2023-07-13,Пологи ,298,7
60,Смачна Забігайлівка,Герман,Жахливо борщ був несмачний страви були холодні рекомендую непоганий салат жахливо. Сучасний Iнтер`Єр велика сирна тарілка сучасний iнтер`єр не сподобалось.,5,2022-05-29,Новояворівськ,155,5
61,Райська Бургерна,Павло,Було Смачно довго чекали на замовлення не сподобалось. Велика Сирна Тарілка могло бути краще світлий зал із чудовим краєвидом раджу спробувати напої власного виробництва найкращі роли могло бути краще піца смачна. Рекомендую класне обслуговування раджу відвідати було смачно було смачно борщ був несмачний принесли холодну каву.,1,2022-03-16,Зміїв,328,3
62,Райська Страва,Адам,Приємні Ціни затишне місце рекомендую чудово принесли холодну каву непоганий салат принесли пересмажений стейк принесли холодну каву.,5,2022-04-02,Бровари,133,4
63,Райська Канапка,Аніта,Було Смачно принесли пересмажений стейк найкращі роли було смачно. Приємні Ціни принесли холодну каву було смачно раджу відвідати чистий столик було смачно довго чекали на замовлення принесли пересмажений стейк.,4,2022-12-22,Сміла,211,12
64,Мʼясна Шашлична,Ольга,Не Сподобалось могло бути краще непоганий салат.,4,2022-05-21,Білицьке,48,5
