id,restaurant_name,reviewer_name,review_text,rating,date_of_visit,location,review_length,month_of_visit
136,Пікантна Колиба,Христина,Кухня На Висоті не сподобалось атмосфера чудова було смачно піца смачна велике меню борщ був несмачний. Жахливо піца смачна принесли холодну каву могло бути краще довго чекали на чек.,1,2024-01-03,Гола Пристань,183,1
137,Вишукана Піцерія,Федір,Гарна Територія було смачно враження позитивні не сподобалось офіціантка повільно обслуговувала раджу спробувати напої власного виробництва світлий зал із чудовим краєвидом.,2,2022-04-13,Керч,173,4
138,Сучасна Варенична,Олесь,Жахливо раджу спробувати напої власного виробництва принесли пересмажений стейк непоганий салат комфортно. Принесли Пересмажений Стейк могло бути краще погане обслуговування принесли пересмажений стейк раджу відвідати враження позитивні раджу відвідати офіціантка повільно обслуговувала.,3,2022-10-23,Пологи ,287,10
139,Сучасна Варенична,Лариса,Рекомендую піца смачна затишне місце жахливо рекомендую. Гарна Територія велике меню рекомендую раджу спробувати напої власного виробництва страви були холодні принесли холодну каву. Чудово непоганий салат рекомендую принесли пересмажений стейк раджу відвідати.,3,2023-03-23,Новоселиця,261,3
140,Відома Таверна,Аарон,Затишне Місце приємні ціни чудово кухня на висоті не сподобалось. Офіціантка Повільно Обслуговувала було смачно борщ був несмачний борщ був несмачний. Приємні Ціни кухня на висоті комфортно довго чекали на замовлення світлий зал із чудовим краєвидом принесли холодну каву атмосфера чудова.,3,2023-09-10,Володимир-Волинський,289,9
141,Грибова Колиба,Симон,Враження Позитивні сучасний iнтер`єр приємні ціни довго чекали на замовлення враження позитивні класне обслуговування.,3,2022-11-28,Зугрес,118,11
142,Мʼясна Страва,Ярослав,Велике Меню погане обслуговування гарна територія кухня на висоті було смачно.,3,2023-12-24,Подільськ,78,12
143,Смачна Забігайлівка,Мілена,Піца Смачна сучасний iнтер`єр комфортно класне обслуговування атмосфера чудова світлий зал із чудовим краєвидом чудово. Рекомендую затишне місце сучасний iнтер`єр класне обслуговування довго чекали на замовлення кухня на висоті чудово.,5,2023-01-28,Благовіщенське,235,1
144,Найкраща Кухня,Прохір,Борщ Був Несмачний сучасний iнтер`єр велика сирна тарілка класне обслуговування могло бути краще.,5,2023-12-07,Приморськ (Україна),97,12
145,Райська Канапка,Панас,Світлий Зал Із Чудовим Краєвидом класне обслуговування найкращі роли велике меню. Кухня На Висоті жахливо велика сирна тарілка кухня на висоті сучасний iнтер`єр. Раджу Відвідати рекомендую враження позитивні приємні ціни. Раджу Спробувати Напої Власного Виробництва принесли холодну каву чистий столик довго чекали на замовлення офіціантка повільно обслуговувала гарна територія принесли холодну каву враження позитивні.,4,2024-01-25,Карлівка,420,1
146,Райська Страва,Степан,Велика Сирна Тарілка страви були холодні піца смачна принесли холодну каву комфортно приємні ціни жахливо враження позитивні. Піца Смачна могло бути краще піца смачна могло бути краще довго чекали на чек світлий зал із чудовим краєвидом комфортно.,2,2023-08-31,Рубіжне,247,8
147,Пікантна Колиба,Одарка,Раджу Відвідати було смачно затишне місце довго чекали на замовлення.,1,2022-10-03,Василівка ,69,10
148,Пікантна Кухня,Леон,Жахливо затишне місце гарна територія раджу спробувати напої власного виробництва принесли холодну каву було смачно. Чистий Столик гарна територія рекомендую затишне місце. Велике Меню принесли пересмажений стейк було смачно.,2,2023-11-16,Почаїв,225,11
149,Грибова Піцерія,Леонтій,Погане Обслуговування затишне місце чистий столик раджу відвідати світлий зал із чудовим краєвидом принесли холодну каву непоганий салат.,1,2022-07-11,Яремче,137,7
150,Грибова Піцерія,Лариса,Принесли Холодну Каву чистий столик піца смачна довго чекали на чек.,1,2022-03-04,Львів,68,3
151,Вишукана Піцерія,Ростислав,Комфортно довго чекали на замовлення довго чекали на чек жахливо. Світлий Зал Із Чудовим Краєвидом не сподобалось принесли холодну каву принесли пересмажений стейк світлий зал із чудовим краєвидом страви були холодні. Гарна Територія було смачно приємні ціни принесли холодну каву приємні ціни страви були холодні непоганий салат.,5,2022-12-16,Тячів,330,12
152,Грибова Піцерія,Богдан,Приємні Ціни могло бути краще гарна територія. Довго Чекали На Замовлення затишне місце рекомендую принесли холодну каву принесли холодну каву. Жахливо кухня на висоті приємні ціни світлий зал із чудовим краєвидом найкращі роли не сподобалось. Жахливо раджу відвідати страви були холодні не сподобалось було смачно.,1,2022-04-05,Перевальськ,315,4
153,Пікантна Насолода,Амвросій,Погане Обслуговування чудово класне обслуговування принесли холодну каву класне обслуговування принесли холодну каву атмосфера чудова. Жахливо чудово велике меню світлий зал із чудовим краєвидом. Офіціантка Повільно Обслуговувала раджу спробувати напої власного виробництва кухня на висоті класне обслуговування не сподобалось.,3,2023-10-20,Ужгород,327,10
154,Вишукана Забігайлівка,Віктор,Офіціантка Повільно Обслуговувала велике меню борщ був несмачний найкращі роли довго чекали на замовлення піца смачна. Чистий Столик принесли холодну каву враження позитивні погане обслуговування.,4,2023-06-05,Кам'янець-Подільський,196,6
155,Райська Страва,Пилип,Довго Чекали На Замовлення офіціантка повільно обслуговувала сучасний iнтер`єр принесли пересмажений стейк чистий столик комфортно піца смачна піца смачна.,3,2023-03-05,Бровари,155,3
156,Найкраща Шампанерія,Софія,Могло Бути Краще кухня на висоті затишне місце раджу спробувати напої власного виробництва чудово світлий зал із чудовим краєвидом було смачно борщ був несмачний.,2,2023-06-12,Татарбунари,162,6
157,Мʼясна Пекарня,Варфоломій,Атмосфера Чудова сучасний iнтер`єр чистий столик жахливо могло бути краще офіціантка повільно обслуговувала не сподобалось рекомендую.,4,2024-01-16,Червоносів,134,1
158,Маленька Шампанерія,Геннадій,Раджу Відвідати рекомендую чистий столик велике меню комфортно світлий зал із чудовим краєвидом велике меню. Велика Сирна Тарілка гарна територія приємні ціни принесли холодну каву затишне місце велике меню чистий столик.,4,2022-09-10,Тульчин,221,9
159,Пікантна Колиба,Орхип,Велика Сирна Тарілка страви були холодні комфортно найкращі роли кухня на висоті чистий столик погане обслуговування комфортно. Піца Смачна було смачно непоганий салат жахливо погане обслуговування найкращі роли довго чекали на чек піца смачна.,5,2023-03-06,Полонне,244,3
160,Райська Бургерна,Мирон,Велика Сирна Тарілка найкращі роли чистий столик найкращі роли непоганий салат. Могло Бути Краще чистий столик чистий столик чистий столик.,1,2023-12-13,Комарно,139,12
161,Мʼясна Пекарня,Вадим,Враження Позитивні враження позитивні довго чекали на чек враження позитивні принесли холодну каву. Враження Позитивні найкращі роли велика сирна тарілка піца смачна офіціантка повільно обслуговувала.,1,2023-12-08,Олександрівськ,200,12
162,Мʼясна Страва,Тетяна,Гарна Територія атмосфера чудова велика сирна тарілка піца смачна борщ був несмачний.,3,2022-12-06,Старий Самбір,85,12
163,Відома Бургерна,Богодар,Погане Обслуговування найкращі роли рекомендую світлий зал із чудовим краєвидом класне обслуговування було смачно велике меню.,2,2022-06-30,Новоазовськ,126,6
164,Райська Канапка,Владислав,Раджу Відвідати гарна територія довго чекали на чек раджу відвідати затишне місце кухня на висоті було смачно. Чудово погане обслуговування класне обслуговування рекомендую. Принесли Холодну Каву не сподобалось раджу відвідати велике меню.,4,2024-02-17,Ромни,239,2
165,Маленька Шампанерія,Ганна,Затишне Місце борщ був несмачний приємні ціни довго чекали на замовлення раджу відвідати враження позитивні борщ був несмачний. Могло Бути Краще довго чекали на чек чудово.,2,2024-02-09,Новояворівськ,172,2
166,Маленька Шампанерія,Єлисей,Найкращі Роли не сподобалось принесли пересмажений стейк рекомендую комфортно. Піца Смачна світлий зал із чудовим краєвидом сучасний iнтер`єр затишне місце комфортно сучасний iнтер`єр класне обслуговування.,3,2023-03-02,Теплодар,206,3
167,Сучасна Варенична,Гаврило,Чистий Столик сучасний iнтер`єр раджу спробувати напої власного виробництва не сподобалось було смачно рекомендую було смачно.,2,2022-03-29,Борзна,126,3
168,Найкраща Шампанерія,Орест,Могло Бути Краще сучасний iнтер`єр класне обслуговування комфортно затишне місце класне обслуговування.,1,2022-08-18,Корець,103,8
169,Затишна Варенична,Ігнат,Приємні Ціни рекомендую раджу спробувати напої власного виробництва світлий зал із чудовим краєвидом.,3,2022-10-30,Підгайці,101,10
170,Грибова Колиба,Прохір,Борщ Був Несмачний сучасний iнтер`єр не сподобалось велика сирна тарілка довго чекали на замовлення найкращі роли не сподобалось.,4,2023-01-08,Синельникове,129,1
171,Райська Кавʼярня,Сергій,Було Смачно чудово чудово. Довго Чекали На Чек велика сирна тарілка погане обслуговування офіціантка повільно обслуговувала.,5,2023-10-30,Покровськ,124,10
172,Найкраща Шампанерія,Віктор,Жахливо комфортно довго чекали на замовлення рекомендую погане обслуговування враження позитивні рекомендую атмосфера чудова.,3,2022-09-26,Апостолове,125,9
173,Грибова Закусочна,Давид,Затишне Місце найкращі роли комфортно світлий зал із чудовим краєвидом погане обслуговування світлий зал із чудовим краєвидом непоганий салат борщ був несмачний.,4,2022-10-10,Авдіївка,161,10
174,Грибова Закусочна,Азар,Непоганий Салат не сподобалось не сподобалось непоганий салат чудово.,5,2022-12-27,Білицьке,69,12
175,Апетитна Пирогівня,Юстим,Було Смачно затишне місце комфортно було смачно. Піца Смачна жахливо кухня на висоті світлий зал із чудовим краєвидом піца смачна рекомендую.,3,2022-09-07,Ямпіль,141,9
176,Пікантна Кухня,Лесь,Атмосфера Чудова класне обслуговування рекомендую.,1,2023-07-22,Іловайськ,50,7
177,Мʼясна Страва,Леонтій,Жахливо не сподобалось атмосфера чудова не сподобалось раджу відвідати. Було Смачно жахливо піца смачна.,5,2022-07-30,Малин,104,7
178,Сучасна Варенична,Олександр,Непоганий Салат не сподобалось світлий зал із чудовим краєвидом непоганий салат принесли пересмажений стейк велике меню рекомендую принесли холодну каву. Непоганий Салат не сподобалось кухня на висоті довго чекали на замовлення рекомендую чудово.,4,2023-11-11,Святогірськ,246,11
179,Пікантна Кухня,Орина,Принесли Холодну Каву кухня на висоті жахливо приємні ціни гарна територія жахливо.,2,2023-12-22,Снігурівка,83,12
180,Найкраща Шампанерія,Вʼячеслав,Було Смачно довго чекали на замовлення велика сирна тарілка кухня на висоті кухня на висоті. Кухня На Висоті найкращі роли затишне місце класне обслуговування чистий столик.,1,2022-06-14,Богуслав,173,6
181,Маленька Шампанерія,Вікторія,Велика Сирна Тарілка принесли холодну каву довго чекали на чек.,1,2022-09-10,Татарбунари,63,9
182,Мʼясна Шашлична,Давид,Кухня На Висоті чудово чистий столик не сподобалось.,1,2024-02-15,Дубляни,52,2
183,Стильна Кавʼярня,Миколай,Не Сподобалось могло бути краще класне обслуговування враження позитивні принесли холодну каву сучасний iнтер`єр могло бути краще.,2,2023-01-15,Бершадь,130,1
184,Ароматна Шампанерія,Едуард,Офіціантка Повільно Обслуговувала атмосфера чудова погане обслуговування не сподобалось гарна територія. Рекомендую кухня на висоті довго чекали на замовлення погане обслуговування принесли пересмажений стейк класне обслуговування чудово.,5,2023-08-23,Харцизьк,238,8
185,Відома Бургерна,Ганна,Не Сподобалось приємні ціни атмосфера чудова непоганий салат. Затишне Місце раджу відвідати кухня на висоті світлий зал із чудовим краєвидом.,3,2023-05-13,Привілля,141,5
186,Вишукана Піцерія,Аніта,Раджу Спробувати Напої Власного Виробництва довго чекали на чек піца смачна чудово. Піца Смачна офіціантка повільно обслуговувала рекомендую принесли пересмажений стейк довго чекали на замовлення.,4,2022-11-11,Василівка ,196,11
187,Райська Бургерна,Аніта,Чистий Столик світлий зал із чудовим краєвидом офіціантка повільно обслуговувала принесли холодну каву довго чекали на чек. Раджу Відвідати довго чекали на замовлення затишне місце чудово принесли холодну каву затишне місце. Атмосфера Чудова рекомендую було смачно затишне місце світлий зал із чудовим краєвидом було смачно велике меню.,1,2023-01-18,Привілля,336,1
188,Райська Пирогівня,Анжела,Атмосфера Чудова не сподобалось гарна територія раджу спробувати напої власного виробництва раджу відвідати принесли холодну каву гарна територія. Сучасний Iнтер`Єр найкращі роли страви були холодні страви були холодні. Довго Чекали На Чек атмосфера чудова враження позитивні приємні ціни світлий зал із чудовим краєвидом погане обслуговування.,2,2022-10-20,Радивилів,344,10
189,Стильна Канапка,Юстина,Погане Обслуговування погане обслуговування раджу спробувати напої власного виробництва затишне місце. Враження Позитивні довго чекали на чек враження позитивні приємні ціни приємні ціни. Принесли Холодну Каву раджу відвідати враження позитивні найкращі роли непоганий салат страви були холодні.,5,2022-09-15,Решетилівка,295,9
190,Пікантна Кухня,Арсен,Непоганий Салат світлий зал із чудовим краєвидом класне обслуговування борщ був несмачний.,4,2023-12-19,Бахмач,90,12
191,Сучасна Варенична,Юстим,Могло Бути Краще довго чекали на чек раджу спробувати напої власного виробництва чистий столик атмосфера чудова непоганий салат офіціантка повільно обслуговувала.,2,2023-07-31,Славута,162,7
192,Найкраща Шампанерія,Наталія,Принесли Пересмажений Стейк раджу відвідати борщ був несмачний. Світлий Зал Із Чудовим Краєвидом страви були холодні непоганий салат. Велике Меню атмосфера чудова офіціантка повільно обслуговувала світлий зал із чудовим краєвидом офіціантка повільно обслуговувала піца смачна.,3,2023-08-01,Авдіївка,276,8
193,Апетитна Пирогівня,Феофан,Не Сподобалось довго чекали на замовлення кухня на висоті гарна територія атмосфера чудова раджу відвідати класне обслуговування. Раджу Відвідати борщ був несмачний погане обслуговування не сподобалось довго чекали на чек борщ був несмачний. Класне Обслуговування атмосфера чудова принесли холодну каву комфортно велике меню затишне місце атмосфера чудова.,3,2023-01-11,Коростишів,356,1
194,Стильна Кавʼярня,Марина,Найкращі Роли світлий зал із чудовим краєвидом довго чекали на замовлення принесли холодну каву кухня на висоті непоганий салат світлий зал із чудовим краєвидом сучасний iнтер`єр. Раджу Відвідати могло бути краще велика сирна тарілка сучасний iнтер`єр довго чекали на чек. Раджу Відвідати комфортно приємні ціни довго чекали на чек.,2,2022-07-15,Кам'янка-Бузька,332,7
