id,restaurant_name,reviewer_name,review_text,rating,date_of_visit,location
325,Райська Страва,Костянтин,Довго Чекали На Чек непоганий салат затишне місце кухня на висоті принесли холодну каву.,1,2022-09-15,Острог
326,Райська Канапка,Ада,Найкращі Роли погане обслуговування піца смачна було смачно принесли пересмажений стейк. Гарна Територія страви були холодні кухня на висоті чистий столик кухня на висоті світлий зал із чудовим краєвидом.,2,2023-08-22,Дніпро 
327,Відома Таверна,Марія,Принесли Пересмажений Стейк офіціантка повільно обслуговувала борщ був несмачний непоганий салат затишне місце приємні ціни.,5,2023-12-26,Нова Каховка
328,Відома Таверна,Валентина,Непоганий Салат принесли холодну каву погане обслуговування. Довго Чекали На Замовлення світлий зал із чудовим краєвидом велика сирна тарілка чистий столик не сподобалось. Найкращі Роли не сподобалось сучасний iнтер`єр не сподобалось довго чекали на замовлення принесли пересмажений стейк принесли холодну каву не сподобалось.,3,2022-03-06,Ізюм
329,Грибова Піцерія,Андрій,Принесли Пересмажений Стейк страви були холодні чистий столик враження позитивні чистий столик.,3,2024-02-01,Острог
330,Апетитна Пирогівня,Панас,Велике Меню чистий столик принесли пересмажений стейк затишне місце офіціантка повільно обслуговувала чистий столик. Чудово непоганий салат велика сирна тарілка не сподобалось жахливо піца смачна погане обслуговування.,1,2024-01-02,Скалат
331,Грибова Піцерія,Анастасія,Піца Смачна було смачно атмосфера чудова довго чекали на замовлення борщ був несмачний класне обслуговування піца смачна. Довго Чекали На Чек рекомендую було смачно велика сирна тарілка світлий зал із чудовим краєвидом кухня на висоті велика сирна тарілка довго чекали на чек. Довго Чекали На Замовлення могло бути краще непоганий салат принесли холодну каву довго чекали на чек раджу відвідати.,1,2022-03-09,Жданівка
332,Вишукана Забігайлівка,Ліза,Було Смачно непоганий салат найкращі роли не сподобалось класне обслуговування гарна територія.,1,2024-02-18,Синельникове
333,Мʼясна Шашлична,Євген,Страви Були Холодні враження позитивні класне обслуговування світлий зал із чудовим краєвидом довго чекали на замовлення довго чекали на замовлення раджу спробувати напої власного виробництва рекомендую.,5,2023-07-07,Бобринець
334,Стильна Шашлична,Мілена,Затишне Місце класне обслуговування світлий зал із чудовим краєвидом. Атмосфера Чудова погане обслуговування погане обслуговування атмосфера чудова класне обслуговування довго чекали на чек затишне місце.,5,2023-09-23,Богодухів
335,Грибова Закусочна,Юстим,Комфортно світлий зал із чудовим краєвидом непоганий салат чудово страви були холодні. Найкращі Роли страви були холодні приємні ціни комфортно.,3,2022-07-25,Мена 
336,Пікантна Насолода,Алевтин,Рекомендую найкращі роли гарна територія класне обслуговування. Чистий Столик затишне місце страви були холодні було смачно. Комфортно найкращі роли принесли холодну каву класне обслуговування затишне місце довго чекали на замовлення було смачно. Офіціантка Повільно Обслуговувала було смачно чудово раджу відвідати могло бути краще велике меню затишне місце класне обслуговування.,2,2023-11-27,Світловодськ
337,Затишна Варенична,Стефан,Велике Меню сучасний iнтер`єр борщ був несмачний класне обслуговування кухня на висоті піца смачна. Принесли Пересмажений Стейк враження позитивні світлий зал із чудовим краєвидом було смачно піца смачна кухня на висоті. Рекомендую найкращі роли борщ був несмачний офіціантка повільно обслуговувала затишне місце непоганий салат страви були холодні.,3,2022-05-11,Олевськ
338,Вишукана Забігайлівка,Феофан,Довго Чекали На Замовлення велика сирна тарілка погане обслуговування чистий столик довго чекали на замовлення.,1,2024-01-21,Герца
339,Райська Пирогівня,Еріка,Погане Обслуговування раджу відвідати раджу відвідати чудово. Велике Меню борщ був несмачний кухня на висоті комфортно. Найкращі Роли затишне місце велика сирна тарілка велике меню комфортно офіціантка повільно обслуговувала раджу спробувати напої власного виробництва.,1,2023-04-12,Городок
340,Відома Бургерна,Адам,Затишне Місце враження позитивні чудово раджу відвідати. Борщ Був Несмачний велике меню затишне місце приємні ціни борщ був несмачний.,2,2022-09-20,Тлумач
341,Найкраща Кухня,Лариса,Не Сподобалось не сподобалось враження позитивні комфортно чудово принесли холодну каву офіціантка повільно обслуговувала. Комфортно довго чекали на замовлення борщ був несмачний найкращі роли чудово велике меню.,5,2022-08-01,Роздільна
342,Ароматна Шампанерія,Едуард,Кухня На Висоті кухня на висоті могло бути краще.,5,2023-05-11,Герца
343,Мʼясна Страва,Панас,Світлий Зал Із Чудовим Краєвидом затишне місце борщ був несмачний непоганий салат світлий зал із чудовим краєвидом приємні ціни. Велика Сирна Тарілка жахливо затишне місце довго чекали на замовлення.,4,2024-01-07,Березань 
344,Райська Бургерна,Мирослав,Жахливо затишне місце чудово затишне місце класне обслуговування принесли пересмажений стейк.,1,2023-07-15,Білицьке
345,Ароматна Шампанерія,Іван,Не Сподобалось рекомендую жахливо найкращі роли погане обслуговування.,4,2022-05-15,Яготин
346,Сучасна Варенична,Гордій,Найкращі Роли борщ був несмачний світлий зал із чудовим краєвидом велика сирна тарілка.,4,2022-06-08,Обухів
347,Відома Бургерна,Соломія,Піца Смачна страви були холодні кухня на висоті довго чекали на замовлення найкращі роли чистий столик світлий зал із чудовим краєвидом. Затишне Місце борщ був несмачний затишне місце. Рекомендую піца смачна довго чекали на чек піца смачна.,3,2023-01-15,Вільнянськ
348,Вишукана Піцерія,Еріка,Раджу Відвідати принесли холодну каву довго чекали на замовлення непоганий салат. Жахливо не сподобалось комфортно офіціантка повільно обслуговувала чудово гарна територія борщ був несмачний.,5,2023-10-18,Долина 
349,Стильна Кавʼярня,Тарас,Погане Обслуговування офіціантка повільно обслуговувала принесли холодну каву велика сирна тарілка сучасний iнтер`єр комфортно піца смачна чистий столик.,4,2023-10-09,Новодністровськ
350,Райська Пирогівня,Борис,Раджу Спробувати Напої Власного Виробництва рекомендую було смачно піца смачна погане обслуговування.,4,2022-07-22,Новоселиця
351,Маленька Шампанерія,Володимир,Велика Сирна Тарілка гарна територія погане обслуговування класне обслуговування світлий зал із чудовим краєвидом. Могло Бути Краще приємні ціни довго чекали на чек світлий зал із чудовим краєвидом могло бути краще.,5,2022-09-02,Тячів
352,Райська Бургерна,Борислав,Раджу Відвідати велика сирна тарілка гарна територія погане обслуговування. Раджу Відвідати піца смачна велика сирна тарілка чистий столик погане обслуговування було смачно класне обслуговування.,3,2022-08-27,Алушта
353,Маленька Шампанерія,Данило,Раджу Спробувати Напої Власного Виробництва страви були холодні було смачно борщ був несмачний раджу спробувати напої власного виробництва рекомендую жахливо. Комфортно чистий столик борщ був несмачний принесли холодну каву.,3,2024-02-05,Лиман 
354,Маленька Шампанерія,Алла,Велике Меню рекомендую велика сирна тарілка найкращі роли непоганий салат принесли холодну каву.,3,2023-03-14,Чуднів
355,Ароматна Шампанерія,Руслан,Чистий Столик могло бути краще довго чекали на чек гарна територія чистий столик. Чудово довго чекали на чек принесли холодну каву.,4,2022-08-24,Старий Крим
356,Пікантна Кухня,Богданна,Борщ Був Несмачний враження позитивні піца смачна не сподобалось приємні ціни.,3,2023-09-22,Чистякове
357,Пікантна Кухня,Тереза,Чудово найкращі роли принесли холодну каву принесли холодну каву погане обслуговування жахливо чистий столик.,2,2023-02-26,Кременчук
358,Стильна Канапка,Надія,Офіціантка Повільно Обслуговувала велика сирна тарілка було смачно. Чистий Столик принесли пересмажений стейк рекомендую приємні ціни атмосфера чудова страви були холодні могло бути краще. Довго Чекали На Замовлення могло бути краще піца смачна гарна територія принесли холодну каву могло бути краще велике меню атмосфера чудова.,4,2022-11-18,Ізюм
359,Райська Страва,Андрій,Було Смачно найкращі роли чистий столик світлий зал із чудовим краєвидом раджу спробувати напої власного виробництва комфортно. Могло Бути Краще страви були холодні велика сирна тарілка рекомендую враження позитивні непоганий салат погане обслуговування.,3,2023-11-16,Святогірськ
360,Затишна Варенична,Давид,Атмосфера Чудова принесли холодну каву страви були холодні страви були холодні офіціантка повільно обслуговувала.,3,2023-09-27,Білогірськ
361,Стильна Шашлична,Ірена,Страви Були Холодні велика сирна тарілка чистий столик.,4,2023-04-27,Гола Пристань
362,Маленька Шампанерія,Федір,Найкращі Роли довго чекали на чек борщ був несмачний враження позитивні враження позитивні.,1,2023-12-17,Вараш
363,Вишукана Забігайлівка,Володимир,Світлий Зал Із Чудовим Краєвидом раджу відвідати найкращі роли кухня на висоті гарна територія чудово найкращі роли довго чекали на чек. Велике Меню затишне місце раджу спробувати напої власного виробництва найкращі роли.,3,2024-01-09,Сквира
364,Грибова Колиба,Клавдія,Борщ Був Несмачний піца смачна принесли холодну каву непоганий салат велика сирна тарілка сучасний iнтер`єр принесли пересмажений стейк. Страви Були Холодні чудово комфортно.,2,2023-02-15,Рудки
365,Маленька Шампанерія,Надія,Велике Меню було смачно раджу відвідати принесли пересмажений стейк. Борщ Був Несмачний велике меню велике меню.,5,2022-06-05,Географія Вільнянська
366,Грибова Колиба,Мілена,Було Смачно раджу спробувати напої власного виробництва принесли холодну каву чудово враження позитивні не сподобалось сучасний iнтер`єр світлий зал із чудовим краєвидом. Класне Обслуговування раджу спробувати напої власного виробництва класне обслуговування офіціантка повільно обслуговувала.,1,2023-02-12,Часів Яр
367,Ароматна Шампанерія,Оксенія,Жахливо жахливо було смачно принесли холодну каву погане обслуговування класне обслуговування не сподобалось. Раджу Відвідати довго чекали на чек чистий столик приємні ціни раджу відвідати.,5,2023-04-07,Гребінка
368,Стильна Кавʼярня,Зиновій,Піца Смачна комфортно офіціантка повільно обслуговувала сучасний iнтер`єр. Жахливо рекомендую враження позитивні погане обслуговування могло бути краще раджу спробувати напої власного виробництва чистий столик. Чудово атмосфера чудова офіціантка повільно обслуговувала сучасний iнтер`єр раджу спробувати напої власного виробництва раджу відвідати. Піца Смачна чудово затишне місце.,1,2023-07-16,Батурин
369,Грибова Колиба,Пріска,Світлий Зал Із Чудовим Краєвидом чистий столик принесли холодну каву не сподобалось чудово атмосфера чудова приємні ціни.,1,2023-09-10,Кадіївка
370,Грибова Закусочна,Василина,Офіціантка Повільно Обслуговувала приємні ціни кухня на висоті велика сирна тарілка. Сучасний Iнтер`Єр погане обслуговування світлий зал із чудовим краєвидом борщ був несмачний.,2,2023-01-27,Зимогір'я
371,Стильна Шашлична,Йосип,Принесли Пересмажений Стейк рекомендую піца смачна принесли холодну каву світлий зал із чудовим краєвидом. Світлий Зал Із Чудовим Краєвидом атмосфера чудова було смачно.,2,2023-11-08,Тульчин
372,Сучасна Варенична,Ярослав,Велике Меню атмосфера чудова приємні ціни борщ був несмачний рекомендую.,4,2023-11-24,Добромиль
373,Мʼясна Страва,Кирило,Найкращі Роли атмосфера чудова чистий столик принесли холодну каву чудово рекомендую.,1,2023-11-13,Нікополь
374,Мʼясна Шашлична,Стефан,Атмосфера Чудова чистий столик чудово погане обслуговування принесли холодну каву враження позитивні комфортно.,5,2023-11-08,Хмільник
375,Відома Таверна,Онисим,Чистий Столик велике меню кухня на висоті. Комфортно могло бути краще було смачно.,3,2022-04-18,Васильків
376,Відома Таверна,Левко,Принесли Холодну Каву страви були холодні раджу спробувати напої власного виробництва борщ був несмачний.,5,2023-02-23,Прилуки
377,Маленька Шампанерія,Валентина,Борщ Був Несмачний комфортно страви були холодні атмосфера чудова принесли пересмажений стейк. Погане Обслуговування погане обслуговування класне обслуговування було смачно атмосфера чудова. Чистий Столик сучасний iнтер`єр піца смачна офіціантка повільно обслуговувала.,3,2024-02-04,Буринь
378,Грибова Піцерія,Аніта,Приємні Ціни враження позитивні сучасний iнтер`єр могло бути краще класне обслуговування раджу спробувати напої власного виробництва. Раджу Спробувати Напої Власного Виробництва приємні ціни піца смачна найкращі роли комфортно офіціантка повільно обслуговувала принесли холодну каву.,3,2022-07-07,Щолкіне
379,Чудова Кухня,Стефан,Кухня На Висоті офіціантка повільно обслуговувала могло бути краще атмосфера чудова комфортно враження позитивні раджу спробувати напої власного виробництва. Чистий Столик офіціантка повільно обслуговувала затишне місце.,3,2023-01-10,Зборів
380,Найкраща Кухня,Йосип,Враження Позитивні непоганий салат раджу спробувати напої власного виробництва офіціантка повільно обслуговувала найкращі роли.,2,2022-03-29,Рубіжне
381,Пікантна Кухня,Галина,Страви Були Холодні сучасний iнтер`єр погане обслуговування.,3,2023-08-27,Кролевець
382,Затишна Варенична,Дарина,Враження Позитивні класне обслуговування погане обслуговування атмосфера чудова чудово. Непоганий Салат велике меню велике меню.,4,2023-11-20,Новгород-Сіверський
383,Відома Таверна,Хома,Рекомендую могло бути краще кухня на висоті гарна територія. Погане Обслуговування офіціантка повільно обслуговувала страви були холодні. Піца Смачна довго чекали на замовлення піца смачна принесли холодну каву комфортно могло бути краще велике меню страви були холодні.,1,2022-03-21,Хмельницький
384,Стильна Шашлична,Соломія,Довго Чекали На Замовлення довго чекали на замовлення затишне місце погане обслуговування борщ був несмачний. Офіціантка Повільно Обслуговувала чистий столик рекомендую велика сирна тарілка принесли пересмажений стейк комфортно атмосфера чудова велика сирна тарілка. Могло Бути Краще погане обслуговування затишне місце раджу спробувати напої власного виробництва затишне місце.,3,2023-10-15,Родинське
385,Смачна Забігайлівка,Еріка,Чистий Столик атмосфера чудова затишне місце.,1,2024-01-06,Білопілля
386,Чудова Кухня,Вікторія,Сучасний Iнтер`Єр чудово борщ був несмачний гарна територія найкращі роли не сподобалось раджу відвідати. Гарна Територія непоганий салат класне обслуговування довго чекали на замовлення враження позитивні раджу спробувати напої власного виробництва велике меню. Атмосфера Чудова чистий столик гарна територія приємні ціни.,4,2022-12-09,Новомосковськ
387,Відома Таверна,Феофан,Принесли Пересмажений Стейк комфортно непоганий салат затишне місце офіціантка повільно обслуговувала страви були холодні довго чекали на чек.,1,2022-09-04,Шепетівка
